pid;typeId;organizerId;topicId;title;subtitle;description;pdf;partner;start;end;time;regEnd;regRequired;extRegLink ;costsReg;costsRed;zip;city;country;address;placeName;targetGroup;contact1Name;contact1Company;contact1Address;contact1Zip;contact1City;contact1Phone;contact1Email;contact2Email;contact3Email;code;trainer;eligibility;isAnnouncement;onlineEvent
1;1;0;2;"Netzwerktreffen ""Strategische Personalarbeit""";Die richtigen Dinge tun - Effektive Personalarbeit im Mittelstand;"<p>Seit 2014 entwickeln wir gemeinsam mit mittelst&auml;ndischen Unternehmen Konzepte und Instrumente zum Thema &bdquo;Strategische Personalarbeit&ldquo;. Nun ist es wieder an der Zeit, neue Ergebnisse und Erfahrungen in gr&ouml;&szlig;erer Runde zu diskutieren. Dazu laden wir Sie herzlich ein!</p>\n<p>Im Zentrum steht dieses Mal das Thema &bdquo;Die richtigen Dinge tun &ndash; Effektive Personalarbeit im Mittelstand&ldquo;. Ihre Erfahrungen dazu k&ouml;nnen Sie in unterschiedlicher Weise mit anderen Praktikern und Experten austauschen &ndash; ob im Plenum, in Kleingruppen, Live-Beratungen oder (nat&uuml;rlich) in den Pausen. Au&szlig;erdem stellen wir Ihnen die zentralen Thesen und Modelle unseres neuen Leitfadens zum Thema vor. Die detaillierte Agenda finden Sie umseitig.&nbsp;</p>\n<p>Die Teilnahme ist kostenlos, eine Anmeldung ist erforderlich. Das Netzwerktreffen findet dieses Mal in den Design Offices in Frankfurt statt &ndash; in passender offener Arbeitsatmosph&auml;re.&nbsp;</p>\n<p>Wir freuen uns, Sie bald dort (wieder) zu treffen!<br />Ihr RKW-Projektteam &bdquo;Wettbewerbsf&auml;hig mit Personalstrategie&ldquo;</p>\n<p>Direkt zur <a href=""http://www2.rkw-kompetenzzentrum.de/nc/veranstaltungen/anmeldung/rkw/veranstaltungen/netzwerktreffen-strategische-personalarbeit-4387/1/"" mce_href=""http://www2.rkw-kompetenzzentrum.de/nc/veranstaltungen/anmeldung/rkw/veranstaltungen/netzwerktreffen-strategische-personalarbeit-4387/1/"" target=""_blank"">Onlineanmeldung</a></p>\n<p><strong>Programm</strong></p>\n<p><strong>11:00 Uhr&nbsp; Begr&uuml;&szlig;ung<br /></strong>Dr. Mandy Pastohr, Leiterin des Fachbereichs &bdquo;Unternehmensentwicklung und Fachkr&auml;ftesicherung&ldquo; im RKW Kompetenzzentrum</p>\n<p><strong>11:15 Uhr&nbsp; Provokationen und Thesen zu Personalarbeit im Mittelstand<br /></strong>RKW-Projektteam &bdquo;Wettbewerbsf&auml;hig mit Personalstrategie&ldquo; &amp; Plenum</p>\n<p><strong>11:45&nbsp;Uhr&nbsp; Zwischen Allzust&auml;ndigkeit und Effektivit&auml;t &ndash;&nbsp;<br />&nbsp;&nbsp;&nbsp;&nbsp;&nbsp;&nbsp;&nbsp;&nbsp;&nbsp;&nbsp;&nbsp;&nbsp;&nbsp;&nbsp;&nbsp;&nbsp;&nbsp;&nbsp;Aufgaben der Personalfunktion I</strong><br />Input von Dr. Thomas Hoffmann &amp; Marlies Kuchenbecker, RKW-Projektteam</p>\n<p><strong>12:15 Uhr &nbsp;Mittagessen</strong></p>\n<p><strong>13:00 Uhr</strong>&nbsp; <strong>Zwischen Allzust&auml;ndigkeit und Effektivit&auml;t &ndash;&nbsp;<br />&nbsp;&nbsp;&nbsp;&nbsp;&nbsp;&nbsp;&nbsp;&nbsp;&nbsp;&nbsp;&nbsp;&nbsp;&nbsp;&nbsp;&nbsp;&nbsp;&nbsp;&nbsp;&nbsp;Aufgaben der Personalfunktion II<br /></strong>Erfahrungsaustausch in moderierten Kleingruppen &amp; <br />Diskussion im Plenum</p>\n<p><strong>14:00 Uhr&nbsp; Zwei Parallele Foren mit Input,&nbsp;<br />&nbsp;&nbsp;&nbsp;&nbsp;&nbsp;&nbsp;&nbsp;&nbsp;&nbsp;&nbsp;&nbsp;&nbsp;&nbsp;&nbsp;&nbsp;&nbsp;&nbsp;&nbsp;&nbsp;Live-Beratung, Diskussion &amp; Kaffeepause<br /><br />Forum 1:&nbsp;&nbsp; Kernkompetenzen und USP &ndash;&nbsp;<br />&nbsp;&nbsp;&nbsp;&nbsp;&nbsp;&nbsp;&nbsp;&nbsp;&nbsp;&nbsp;&nbsp;&nbsp;&nbsp;&nbsp;&nbsp;&nbsp;&nbsp;&nbsp;Zentrale Elemente effektiver Personalarbeit<br /></strong>Moderation: Dr. Thomas Hoffmann, Patrick Gro&szlig;heim &amp; Alexander Sonntag, RKW Projektteam</p>\n<p><strong>Forum 2:&nbsp;&nbsp;&nbsp; Auftr&auml;ge und Aufgaben kl&auml;ren &ndash;&nbsp;<br />&nbsp;&nbsp;&nbsp;&nbsp;&nbsp;&nbsp;&nbsp;&nbsp;&nbsp;&nbsp;&nbsp;&nbsp;&nbsp;&nbsp;&nbsp;&nbsp;&nbsp;&nbsp;&nbsp;Vertiefung &amp; Umsetzung<br /></strong>Moderation: Kathrin Gro&szlig;heim &amp; Sascha Hertling, RKW-Projektteam</p>\n<p><strong>16:00 Uhr&nbsp; Gemeinsames Res&uuml;mee im Plenum und Ausklang</strong></p>\n<p>Standortinformation finden Sie <a href=""https://www.designoffices.de/fileadmin/Webdaten/00_Downloads/Standortinfo/frankfurt_westend_standortinformation.pdf"" mce_href=""https://www.designoffices.de/fileadmin/Webdaten/00_Downloads/Standortinfo/frankfurt_westend_standortinformation.pdf"" target=""_blank"">hier</a>.</p>\n<p>Die Anfahrtsskizze k&ouml;nnen Sie <a href=""https://www.designoffices.de/fileadmin/Webdaten/00_Downloads/Anfahrtsbeschreibung/frankfurt_westend_anfahrtsbeschreibung.pdf"" mce_href=""https://www.designoffices.de/fileadmin/Webdaten/00_Downloads/Anfahrtsbeschreibung/frankfurt_westend_anfahrtsbeschreibung.pdf"" target=""_blank"">hier </a>&ouml;ffnen<strong>.</strong><span style=""font-size: 11pt;""><strong>&nbsp;</strong></span>&nbsp;</p>";;;2016-12-01;2016-12-01;11:00 bis 16:00 Uhr;0000-00-00;1;;kostenfrei;;60325;Frankfurt;D;Barckhausstraße 1;Design Offices Frankfurt Westend;Geschäftsführer und Personalleiter aus kleinen und mittleren Unternehmen;Kathrin Großheim;RKW Kompetenzzentrum;Düsseldorfer Straße 40 A;65760;Eschborn;06196 495-2813;k.grossheim@rkw.de;;;123;Mr. A;1;1;0
1;1;0;2;Webinar - Für Ziele sorgen in mittelständischen Unternehmen;;"<p>Strategisches Management ist wichtiger denn je! Es erm&ouml;glicht vorhandene Kr&auml;fte zu b&uuml;ndeln und die notwendigen Grundlagen rechtzeitig vorzubereiten, um auch morgen noch erfolgreich im Gesch&auml;ft zu sein. Eine Strategie allein bringt allerdings nichts, wenn es nicht gelingt, sie mit Leben zu f&uuml;llen und in die Umsetzung zu bringen.</p>\n<p>Was trivial klingt, ist unserer Erfahrung nach ein wesentlicher Grund, warum Strategien in Unternehmen h&auml;ufig blo&szlig; auf dem Papier existieren: Sie werden nicht konsequent mit der Jahresplanung verzahnt und haben damit kaum eine Chance Teil der Ziele und Aufgaben einzelner Mitarbeiter zu werden. Die besten Voraussetzungen also, um im turbulenten Alltagsgesch&auml;ft unterzugehen!</p>\n<p>Wie strategische Ziele Ihren Weg erfolgreich bis zum einzelnen Mitarbeiter finden, stellen wir Ihnen im Webinar&nbsp; &bdquo;F&uuml;r Ziele sorgen in mittelst&auml;ndischen Unternehmen&ldquo; kostenfrei vor. Statt auf hoch formalisierte Zielevereinbarungssysteme setzen wir dabei auf ganz pragmatische Orientierungshilfen und Tools.</p>\n<p><strong>Der Link f&uuml;r den Webinar-Zugang lautet:</strong></p>\n<p><a href=""https://eu42.spreed.com/selfreg/280884812/register"" mce_href=""https://eu42.spreed.com/selfreg/280884812/register"">https://eu42.spreed.com/selfreg/280884812/register</a></p>";;;2016-12-06;0000-00-00;15 bis 16 Uhr;0000-00-00;1;; ;;65760;Eschborn;D;Düsseldorfer Straße 40 A;RKW Kompetenzzentrum;Geschäftsführer & Führungskräfte;Alexander Sonntag;RKW Kompetenzzentrum;Düsseldorfer Straße 40 A;65760;Eschborn;06196 495 32 30;sonntag@rkw.de;;;456;Ms. B;0;0;1
1;1;0;3;Digitales Planen, Bauen und Betreiben mit Preisverleihung im Wettbewerb Auf IT gebaut;;"<p>Das Bauen der Zukunft ist digitalisiert und vernetzt. Beim&nbsp; modellbasierten Arbeiten (BIM) geben die Baubeteiligten ihre Bauwerksdaten in ein digitales Modell ein und k&ouml;nnen diese jederzeit wieder abrufen. Damit wird die Zusammenarbeit der Baubeteiligten verbessert, Bauprozesse optimiert und insgesamt eine bessere Planungs- und Ausf&uuml;hrungsqualit&auml;t erreicht.</p>\n<p>Durch die neuen digitalen Arbeitsmethoden werden sich allerdings Arbeitsprozesse, Gesch&auml;ftsmodelle und klassische Rollenverteilungen in den Unternehmen &auml;ndern. Gerade die vielen kleinen Planungsb&uuml;ros und mittelst&auml;ndischen Unternehmen der Bauwirtschaft m&uuml;ssen sich mit den neuen digitalen Arbeitsmethoden besch&auml;ftigen, um keine Wettbewerbsnachteile zu erleiden.</p>\n<p>Wie k&ouml;nnen Planungsb&uuml;ros und Bauunternehmen durch BIM profitieren? Was funktioniert bisher gut, wo gibt es Probleme? Welche Vorbereitungen und Qualifikationen sind erforderlich? Welche Regeln und Standards m&uuml;ssen beachtet werden? Referenten aus der Baupraxis geben Antworten, zeigen konkrete Beispiele und bieten L&ouml;sungen f&uuml;r die Einf&uuml;hrung digitaler Arbeitsmethoden in die Unternehmenspraxis.</p>\n<p>Zum Abschluss der Veranstaltung werden wieder die besten Nachwuchskr&auml;fte der Branche im Wettbewerbs &bdquo;Auf IT gebaut&ldquo; ausgezeichnet. Unter dem Motto &bdquo;Bauwirtschaft innovativ&ldquo; werden die besten Arbeiten und die Preistr&auml;ger vorgestellt.</p>\n<p>Informationen zu weiteren Veranstaltungen auf der BAU 2017 finden Sie <a href=""https://www.rkw-kompetenzzentrum.de/rg-bau/transfer/bau-2017-in-muenchen/"" mce_href=""https://www.rkw-kompetenzzentrum.de/rg-bau/transfer/bau-2017-in-muenchen/"" title=""www.rkw-kompetenzzentrum.de"">hier</a>.</p>";;;2017-01-17;0000-00-00;10:30 - 13:30 Uhr;2017-01-10;1;;kostenfrei;;81823;München;D;Messe München, Messegelände;Messe München, ICM, Saal 14A;Planer, Bauunternehmen, Betreiber sowie Studierende und Auszubildende im Baubereich;Blochmann, Günter;RG-Bau im RKW Kompetenzzentrum;Düsseldorfer Straße 40 A;65760;Eschborn;06196-4953502;blochmann@rkw.de;megerlin@rkw.de;fleischmann@rkw.de;789;Mr. C;1;1;0
1;1;0;2;SmartHome - mit Gebäudeautomatisierung die Energiewende schaffen;;"<p>Smart Home hat das Potenzial, sich zu einem Milliardenmarkt auch f&uuml;r deutsche Unterneh-men zu entwickeln. Dies belegt eine im Auftrag des BMWi erstellte Studie . Insbesondere im Bereich der Geb&auml;udeautomatisierung bieten sich gro&szlig;e Chancen um Energie im Geb&auml;ude einzusparen. In der Welt von Industrie 4.0 und dem Internet of Things gibt es dazu weit mehr M&ouml;glichkeiten als z. B. die Erneuerung der Heizkessel und den hydraulischen Abgleich. Smart Home bedeutet nicht nur Kommunikation, Komfort und Sicherheit sondern kann wirksam zur Energiewende beitragen. Gleichzeitig kann die Bauwirtschaft von dem Boom profitieren.<br />In der Veranstaltung wird anhand von guten Beispielen gezeigt, wie man mit SmartHome-Technologie Energieeffizienz in Bauprojekten erreichen kann. Zus&auml;tzlich wird gezeigt, wie die wirtschaftlichen Potenziale der Technologie von Planern, bauausf&uuml;hrende Unternehmen und dem Bauhandwerk genutzt werden k&ouml;nnen. Aufgrund der Besonderheiten der Branchen Bauwirtschaft und IT bzw. SmartHome-Anbieter ist der Weg dahin allerdings nicht einfach. Deshalb m&uuml;ssen sich beide Seiten kennen und verstehen lernen. Beide Seiten m&uuml;ssen ihre Wertsch&ouml;pfungsprozesse &uuml;berdenken und aufeinander abstimmen. Und last but not least: Die wirtschaftlichen und rechtlichen Rahmenbedingungen (z.B. Entgeltmodelle und An-reizsysteme, Zulassungsregeln und Standards, Haftung- und Gew&auml;hrleistungsrecht) m&uuml;ssen &uuml;berpr&uuml;ft und angepasst werden. Diese Themen sollen deshalb in einer Podiumsdiskussion mit Branchenvertretern zur Sprache kommen.</p>\n<p>Fortbildungspunkte bei folgenden Architektenkammern: dena Energieeffizienz- Expertenliste.</p>\n<p>Informationen zu weiteren Veranstaltungen auf der BAU 2017 finden Sie <a href=""https://www.rkw-kompetenzzentrum.de/rg-bau/transfer/bau-2017-in-muenchen/"" mce_href=""https://www.rkw-kompetenzzentrum.de/rg-bau/transfer/bau-2017-in-muenchen/"" title=""www.rkw-kompetenzzentrum.de"">hier</a>.</p>";;;2017-01-18;0000-00-00;10:30 - 14:00 Uhr;2017-01-10;1;;kostenfrei;;81823;München;D;Messegelände;Messe München, ICM, Saal 2;Energieberater, Architekten, TGA-Planer, Elektro- und SHK-Handwerk, Bauherren, Wohnungswirtschaft, Hersteller Smart Home, Gebäudeautomation, TGA;Juschkus, Ute;RG-Bau im RKW Komptezenzzentrum;Düsseldorfer Straße 40 A;65760;Eschborn;+49 (0) 6196 495 3505;juschkus@rkw.de;megerlin@rkw.de;fleischmann@rkw.de;321;Ms. D;0;0;0
1;1;0;6;Hightech-Materialien am Bau - Innovationen und Trends bei neuen Baustoffen;;"<p>Hightech &ndash; Lowtech &ndash; Ressourceneffizienz: die Ergebnisse der Baustoffforschung sind vielf&auml;ltig. Sie reichen vom Hightech-Baumaterial auf der Basis von Nanotechnologie bis hin zu innovativen Anwendungen von traditionellen und Naturbaustoffen. Sie beziehen sich auf alle Anwendungsgebiete im Bauwesen, den Hochbau, den Stra&szlig;enbau, Fassaden, D&auml;cher und auch auf den Bereich der Innenarchitektur. Baustoffinnovationen marktreif zu gestalten ist ein aufwendiger und langwieriger Prozess. Es m&uuml;ssen Pilotprojekte durchgef&uuml;hrt, notwendige Standardisierungen veranlasst und Bauzulassungen eingeholt werden. Bauherren, Architekten und bauausf&uuml;hrende Unternehmen m&uuml;ssen den Nutzen der neuen Materialien erkennen und in ihrer Verwendung geschult werden. Trotzdem gibt es viele gute und erfolgreiche Beispiele von neuen Baustoffen. <br />In Fortsetzung der Veranstaltungen &bdquo;Nanotechnik und Bionik &ndash; Hightech in der Bauwirtschaft&ldquo; (BAU 2011) und Hightech-Materialien am Bau (BAU 2013) soll das weiterhin hochaktuelle Thema wieder aufgegriffen werden. Die Veranstaltung zeigt gute Beispiele aus Forschung und Baupraxis. Neue Forschungsergebnisse&nbsp; aus dem F&ouml;rderschwerpunkt HighTechMatBau des BMBF werden ebenso pr&auml;sentiert wie z. B. Ultrahochfester Beton (UHPC), Vakuumisolationspaneele (VIP) und Aerogel mit neuen Einsatzm&ouml;glichkeiten und innovativer Verwertungsstrategie. Die Veranstaltung richtet sich prim&auml;r an Planer und bauausf&uuml;hrende Unternehmen, Bauforschung und Baustoffhersteller. Aber auch Bauherren wie die &ouml;ffentliche Hand, Wohnungswirtschaft und Projektentwickler werden angesprochen.</p>\n<p>Informationen zu weiteren Veranstaltungen auf der BAU 2017 finden Sie <a href=""https://www.rkw-kompetenzzentrum.de/rg-bau/transfer/bau-2017-in-muenchen/"" mce_href=""https://www.rkw-kompetenzzentrum.de/rg-bau/transfer/bau-2017-in-muenchen/"" title=""www.rkw-kompetenzzentrum.de"">hier</a>.</p>";;;2017-01-19;0000-00-00;10:30 - 13:30 Uhr;2017-01-10;1;;kostenfrei;;81823;München;D;Messegelände;Messe München, Konferenzraum A51/52 - im ersten OG der Halle A5;Bauunternehmen, Architekten und Bauingenieure, Baustoffforschung, Baustoffhandel und Baustoffindustrie, Innovationsberater und Technolologietransferstellen;Juschkus, Ute;RG-Bau im RKW Kompetenzzentrum;Düsseldorfer Str. 40A;65760;Eschborn;+49 (0) 6196 495 3505;juschkus@rkw.de;megerlin@rkw.de;fleischmann@rkw.de;654;Mr. E;1;1;0
1;1;0;2;Frauen in der Bauwirtschaft - Potentiale stärker erschließen;;"<p>Der demografische Wandel stellt die deutsche Bauwirtschaft vor gro&szlig;en Herausforderungen. Mit zunehmendem Fachkr&auml;ftemangel r&uuml;ckt das Arbeitskr&auml;ftepotenzial von Frauen in den Fokus betrieblicher Personalwirtschaft. Bisher sind nur ca. 10 Prozent der sozialversicherungspflichtig Besch&auml;ftigten im deutschen Bauhauptgewerbe Frauen.&nbsp;&nbsp; Aufgrund der Nachwuchssorgen der Branche sind Frauen auch in den klassischen Bauberufen willkommen. Bisher entscheiden sich allerdings nur wenige M&auml;dchen und Frauen f&uuml;r eine Ausbildung und Karriere in einem Bauberuf. Auch in den Spitzenpositionen in der Bauwirtschaft sind Frauen bisher immer noch eine Seltenheit. Aber auch hier gibt es positive Beispiele erfolgreicher Unternehmerinnen, die vorangebracht werden m&uuml;ssen. Durch eine gezielte Karriere- und Entwicklungsplanung sowie familienfreundliche Arbeitsgestaltung k&ouml;nnten Frauen gezielt&nbsp; f&uuml;r die Bauwirtschaft angesprochen und gewonnen und damit der wachsende Bedarf an Fachkr&auml;ften insbesondere in kleinen und mittleren Bauunternehmen gesichert, wichtige Schl&uuml;sselpositionen qualifiziert besetzt und eine ausgewogene Personalstruktur entwickelt werden.<br />Die RG-Bau im RKW Kompetenzzentrum m&ouml;chte einen Beitrag leisten, um das Potential von Frauen st&auml;rker f&uuml;r die Bauwirtschaft zu erschlie&szlig;en und zu nutzen.&nbsp; In einem Workshop im Rahmen der BAU 2017 sollen positive Beispiele und Vorbilder gezeigt, dringende Handlungsfelder wie z. B. &bdquo;Ausbildung von Frauen in technischen Berufsfeldern&ldquo; &bdquo;F&uuml;hrung und Karriere&ldquo; oder &bdquo;Vereinbarkeit von Familie und Beruf&ldquo; diskutiert und Handlungsempfehlungen f&uuml;r die Zukunft erarbeitet werden.</p>\n<p>Informationen zu weiteren Veranstaltungen auf der BAU 2017 finden Sie <a href=""https://www.rkw-kompetenzzentrum.de/rg-bau/transfer/bau-2017-in-muenchen/"" mce_href=""https://www.rkw-kompetenzzentrum.de/rg-bau/transfer/bau-2017-in-muenchen/"" title=""www.rkw-kompetenzzentrum.de"">hier</a>.</p>";;;2017-01-20;0000-00-00;10:15 Uhr - 13:30 Uhr;2017-01-10;1;;kostenfrei;;81823;München;D;Messegelände;Messe München, Konferenzraum A51/52 - im ersten OG der Halle A5;Führungskräfte, Personalverantwortliche und Arbeitnehmervertreter mittelständischer Bauunternehmen, Verbände und Institutionen in Bayern und im gesamten Bundesgebiet, Bildungsträger, Experten aus Personaldienstleistung sowie Unternehmensberatung mit dem Schwerpunkt Management und Coaching sowie die KMU der Bauwirtschaft;Leis, Tanja;RG-Bau im RKW Kompetenzzentrum;Düsseldorfer Straße 40 A;65760;Eschborn;+49 (0) 6196 495 3525;leis@rkw.de;megerlin@rkw.de;fleischmann@rkw.de;987;Ms. F;0;0;0
